Job,Publish Date,Skills,Budget,Bids,Summary,Link
Desenvolvimento de Ferramenta Para Checkout Web com Integrações com Erp,11 de Maio de 2023 12:50,"Magento, PHP, WordPress",USD 1.000 - 3.000,1,"Procuro dev full stack para projeto de desenvolvimento de ferramenta checkout web (no site do cliente) com integração api em erp.

Categoria: TI e Programação
Subcategoria: Lojas Virtuais (e-commerce)
Qual é o alcance do projeto?: Alteração média
Isso é um projeto ou uma posição de trabalho?: Um projeto
... Ver mais detalhes",https://www.workana.com/job/desenvolvimento-de-ferramenta-para-checkout-web-com-integracoes-com-erp?ref=projects_1
